{
  "schema": 1,
  "annotated_utc": "2026-09-10T00:00:00Z",
  "plan_section": "18",
  "annotator": "read by eye from the delivered photograph, one pass per image",
  "note": "What is PRINTED ON THE PANEL IN THIS FRAME, not what the product is known to declare elsewhere. A declaration on another face of the pack is absent here, because the frame is what the extractor is given. A field mapped to null is printed but its value is not legible in this frame, or the pack prints a cross-reference ('See on Crimp') instead of a value. A list means the panel carries more than one distinct value for that field.",
  "field_mapping": "Rule 6(1)(a)'s name-and-address is annotated by the label actually printed: 'Manufactured by' / 'Marketed by' / 'Mktd. by' / 'Mfg. by' -> manufacturer; 'Packed by' -> packer; 'Imported by' -> importer. This matches how vision/classify/regex_tier.py resolves the same labels, so a score against these labels measures extraction rather than a disagreement about vocabulary.",
  "images": [
    {
      "image": "agarbati.webp",
      "product": "Sri Sri Tattva incense sticks, 15 N",
      "fields": {
        "generic_name": "Incense Stick",
        "net_quantity": "15 NUMBER",
        "mrp": "150.00",
        "manufacturer": "OMEGA INCENSE, 23, Vaishnodevi Industrial Estate, Bheemanahalli, Bidadi Hobli, Ramanagar - 562109, Karnataka, India",
        "consumer_care": "For queries or complaints contact customer care executive at 'Marketed by' address. Call: 1800-120-8030, e-mail: care@srisritattva.com",
        "country_of_origin": "PRODUCT OF INDIA"
      },
      "notes": "E-commerce render of a full side panel. No manufacturing date anywhere in the frame."
    },
    {
      "image": "bajaj.jpg",
      "product": "Bajaj LEDZ Eterno inverter lamp 9W",
      "fields": {
        "generic_name": "LED LAMPS",
        "net_quantity": "1U",
        "mrp": "745.00",
        "mfg_date": "02/2024",
        "manufacturer": "M/S. Bajaj Electricals Limited, 45/47 Veer Nariman Road, Mumbai-400001, Maharashtra",
        "country_of_origin": "MADE IN INDIA"
      },
      "notes": "Reverse type: light print on a black carton. The MRP and date sit in a white sticker panel at the foot. Consumer care is cut off by the bottom edge of the frame and is therefore absent here."
    },
    {
      "image": "camlin.webp",
      "product": "Kokuyo Camlin Grip Pro 0.7 mm mechanical pencil",
      "fields": {
        "generic_name": "Mechanical Pencil",
        "net_quantity": "1 N",
        "mrp": ["30.00", "29.00"],
        "mfg_date": "10/2025",
        "manufacturer": "Kokuyo Camlin Ltd., 48/2, Hilton House, Central Road, MIDC, Andheri (E), Mumbai - 400 093, Maharashtra, India",
        "consumer_care": "Consumer Care Cell: The Manager, address as above. Tel: 022-6655 7007, support@kokuyocamlin.com"
      },
      "notes": "Two maximum retail prices on one panel: 'New MRP (Incl. of all taxes): Rs 29.00' printed above 'MRP (Incl. of all taxes): Rs 30.00'. Rule 6(3) material and the reason this frame is in the set."
    },
    {
      "image": "camlinbrush.jpg",
      "product": "Kokuyo Camlin brush pen, 12 N assorted",
      "fields": {
        "generic_name": "Brush Pen (Assorted Shades)",
        "net_quantity": "12 N",
        "mrp": "225.00",
        "mfg_date": "12/2024",
        "batch": "L 2524",
        "manufacturer": "Kokuyo Camlin Ltd., Plot No. F-8, Additional Patalganga MIDC, Village- Chavane, Tal.- Panvel, Dist.- Raigad, Maharashtra - 410220, India",
        "consumer_care": "Consumer Care Cell: The Manager, Address of H.O., Tel: 022-66557007, support@kokuyocamlin.com",
        "country_of_origin": "Made in India"
      },
      "notes": "600x450 crop, the smallest frame in the set. The declaration block is a yellow-tinted table on a pale blister card."
    },
    {
      "image": "cheese.jpg",
      "product": "Go / Parag cheddar cheese block, 200 g",
      "fields": {
        "net_quantity": "200 g (7.05 oz)",
        "mrp": "140.00",
        "mfg_date": "28/01/2021",
        "expiry_date": "27/10/2021",
        "batch": null,
        "manufacturer": "Parag Milk Foods Ltd., Awasari Phata, Manchar, Dist. Pune - 410 503",
        "consumer_care": "customercare@paragmilkfoods.com; Customer Care 1800 1033 611",
        "country_of_origin": "ORIGIN OF INDIA"
      },
      "notes": "Dot-matrix overprint on a white strip: the MRP numeral is broken enough that '140.00' is a confident read only because of the decimal group. The batch code is printed but not confidently legible. No commodity name on this face; 'Cheddar Cheese' appears only inside the ingredients list, which is not a generic-name declaration."
    },
    {
      "image": "coconut_oil.jpg",
      "product": "M.P coconut oil pouch",
      "fields": {
        "generic_name": "Coconut Oil",
        "mrp": "199",
        "mfg_date": "11/5/24",
        "expiry_date": "10/11/24",
        "batch": "MP 04 KLVO/03/24",
        "country_of_origin": "PRODUCT OF INDIA"
      },
      "notes": "Hardest frame in the set: the declaration strip is rotated 90 degrees, the pouch is curved and glossy, and a hand covers the left third. The net quantity is under the hand and is not readable in this frame, so it is annotated absent."
    },
    {
      "image": "doms.webp",
      "product": "DOMS Inxtra ball point pen, 10 N",
      "fields": {
        "generic_name": "BALL POINT PEN",
        "net_quantity": "10 Numbers",
        "mrp": "50.00",
        "mfg_date": "10/2024",
        "manufacturer": "DOMS Industries Limited, J-19, G.I.D.C., Umbergaon-396171, Dist. Valsad, Gujarat, India",
        "consumer_care": "Consumer Care Cell: For feedback, write to: The Manager, Address as Above. Tel: 1-800-2741250 (toll free), info@domsindia.com",
        "country_of_origin": "MADE IN INDIA"
      },
      "notes": "Declaration printed on a card inside a clear blister, photographed through the plastic."
    },
    {
      "image": "frshcream.jpg",
      "product": "face cream, 15 g",
      "fields": {
        "generic_name": "फेस क्रीम",
        "net_quantity": "15 g",
        "mrp": "500.00",
        "mfg_date": "08/23",
        "batch": "CE-11002",
        "country_of_origin": "MADE IN INDIA"
      },
      "notes": "Devanagari commodity name. Curved bottle, small print, hand in frame. Manufacturer and consumer care are on the hidden side of the tube and absent here."
    },
    {
      "image": "ghee.jpg",
      "product": "Amul ghee pouch, 1 L",
      "fields": {
        "net_quantity": "1 L (905 g)",
        "mrp": "650.00",
        "mfg_date": "27/DEC/2024",
        "expiry_date": "23/SEP/2025",
        "batch": "PAN3622",
        "manufacturer": "Gujarat Co-operative Milk Marketing Federation Ltd., Amul Dairy Road, Anand, Gujarat - 388001, India",
        "consumer_care": "Customer Care Executive at 1800 258 3333 (Toll-free) [6AM-9PM], customercare@amul.coop, GCMMF Ltd., Anand - 388001"
      },
      "notes": "Foil pouch with a specular seam running down the middle of the frame, splitting the panel into two columns. MRP, packing and expiry are in the right column; the address block is in the left. No commodity name on this face."
    },
    {
      "image": "gillete.jpg",
      "product": "Gillette Mach3 razor, 1 N",
      "fields": {
        "generic_name": "Razor",
        "net_quantity": "1N RAZOR",
        "mrp": "275.00",
        "mfg_date": "12/23",
        "manufacturer": "Yamada Electric Ind Co Ltd, RM 508A 5 F Empire Centre Mody Road, Hong Kong (handle); Procter & Gamble Indochina Ltd, Vietnam (cartridge)",
        "importer": "Gillette India Limited, P&G Plaza, Cardinal Gracias Road, Andheri (E), Mumbai 400099, MH, India",
        "consumer_care": "Consumer Relations on 1800-202-1364 or intouch.im@pg.com"
      },
      "notes": "An imported pack: manufacturer, importer and packer are all declared, in a single justified paragraph of very small print. No explicit country-of-origin line."
    },
    {
      "image": "goodday.jpg",
      "product": "Britannia Good Day, 120 g + 30 g extra",
      "fields": {
        "net_quantity": "120 g + 30 g EXTRA = 150 g",
        "mrp": "25.00",
        "mfg_date": "19/06/22",
        "expiry_date": "18/12/22",
        "batch": "B062207",
        "manufacturer": "Britannia Industries Ltd."
      },
      "notes": "600x361, the lowest-resolution frame in the set. Label column and value column are separated by 15 mm of white sticker, so every value has to be associated across a gap."
    },
    {
      "image": "goodday_butter.jpg",
      "product": "Britannia Good Day butter cookies",
      "fields": {
        "mrp": "150.00",
        "mfg_date": "21/07/25",
        "expiry_date": "18/03/26",
        "batch": "B0725°A",
        "manufacturer": "Britannia Industries Ltd."
      },
      "notes": "Held in the hand over a plate of the biscuits; the pack is tilted about 20 degrees and the label column runs off the left edge. Net quantity is on the part of the pack behind the fingers and is absent here."
    },
    {
      "image": "gulabjal.jpg",
      "product": "L'Oreal hair product, 200 ml",
      "fields": {
        "net_quantity": "200 ml",
        "mrp": "259.00",
        "mfg_date": "05/25",
        "expiry_date": "04/28",
        "batch": "B52218815C",
        "manufacturer": "L'Oreal India Pvt. Ltd., A-Wing, 8th Floor, Marathon Futurex, N. M. Joshi Marg, Lower Parel, Mumbai - 400013",
        "consumer_care": "Consumer Advisor, at Regd. office; Tel: 1800-22-3000; Advisor.India@loreal.com"
      },
      "notes": "Filename says gulabjal; the pack is a L'Oreal bottle. Transparent bottle photographed against a bright background, so the print is over a shifting backdrop. The dot-matrix block reads B52218815C / 05.25,04/28 / Rs.259.00 / Rs.1.30/ml against the labels Batch No., Mfd. Date, Use Before, MRP, Unit Sale Price printed underneath it rather than beside it."
    },
    {
      "image": "happyhappy.png",